
SQL*Plus: Release 12.1.0.1.0 Production on Fri Jun 9 08:33:53 2023

Copyright (c) 1982, 2013, Oracle.  All rights reserved.

Enter user-name: s22mca014@oracle
Enter password:
Last Successful login time: Mon Apr 24 2023 09:03:37 +05:30

Connected to:
Oracle Database 12c Enterprise Edition Release 12.1.0.2.0 - 64bit Production
With the Partitioning, OLAP, Advanced Analytics and Real Application Testing options

SQL> create table sailors (sid int not null primary key, sname, varchar(25), rating number(2), age number);
create table sailors (sid int not null primary key, sname, varchar(25), rating number(2), age number)
                                                           *
ERROR at line 1:
ORA-00904: : invalid identifier


SQL> create table sailors (sid int not null primary key, sname varchar(25), rating number(2), age number);
create table sailors (sid int not null primary key, sname varchar(25), rating number(2), age number)
             *
ERROR at line 1:
ORA-00955: name is already used by an existing object


SQL> select * from sailors
  2  ;

no rows selected

SQL> select * from sailors;

no rows selected

SQL> desc sailors;
 Name                                      Null?    Type
 ----------------------------------------- -------- ----------------------------
 SID                                       NOT NULL NUMBER
 SNAME                                              VARCHAR2(25)
 RATING                                             NUMBER(5)
 AGE                                                NUMBER

SQL> insert into sailors values(22,'DUSTIN',7,45);

1 row created.

SQL> insert into sailors values(29,'Brutus',1,33);

1 row created.

SQL> insert into sailors values(31,'Lubber',8,55);

1 row created.

SQL> insert into sailors values(32,'Andy',8,25);

1 row created.

SQL> insert into sailors values(58,'Rusty',10,35);

1 row created.

SQL> insert into sailors values(64,'Horatio',7,35);

1 row created.

SQL> insert into sailors values(71,'Zorba',10,16);

1 row created.

SQL> insert into sailors values(74,'Horatio',9,35);

1 row created.

SQL> insert into sailors values(85,'Art',3,26);

1 row created.

SQL> insert into sailors values(95,'Bob',3,64);

1 row created.

SQL> select * from sailors;

       SID SNAME                         RATING        AGE
---------- ------------------------- ---------- ----------
        22 DUSTIN                             7         45
        29 Brutus                             1         33
        31 Lubber                             8         55
        32 Andy                               8         25
        58 Rusty                             10         35
        64 Horatio                            7         35
        71 Zorba                             10         16
        74 Horatio                            9         35
        85 Art                                3         26
        95 Bob                                3         64

10 rows selected.

SQL> update sailors where sid =22 set sname="Dustin";
update sailors where sid =22 set sname="Dustin"
               *
ERROR at line 1:
ORA-00971: missing SET keyword


SQL> update sailors set sname="Dustin" where sid =22;
update sailors set sname="Dustin" where sid =22
                         *
ERROR at line 1:
ORA-00904: "Dustin": invalid identifier


SQL> update sailors set sname='Dustin' where sid =22;

1 row updated.

SQL> select * from sailors;

       SID SNAME                         RATING        AGE
---------- ------------------------- ---------- ----------
        22 Dustin                             7         45
        29 Brutus                             1         33
        31 Lubber                             8         55
        32 Andy                               8         25
        58 Rusty                             10         35
        64 Horatio                            7         35
        71 Zorba                             10         16
        74 Horatio                            9         35
        85 Art                                3         26
        95 Bob                                3         64

10 rows selected.


SQL> create table boats (Bid int not null primary key, bname varchar(25), color varchar(20));

Table created.


SQL> insert into boats values(101,'Interlake','Blue');

1 row created.

SQL> insert into boats values(102,'Interlake','Red');

1 row created.

SQL> insert into boats values(103,'Clipper','Green');

1 row created.

SQL> insert into boats values(104,'Marine','Red');

1 row created.

SQL> select * from boats;

       BID BNAME                     COLOR
---------- ------------------------- --------------------
       101 Interlake                 Blue
       102 Interlake                 Red
       103 Clipper                   Green
       104 Marine                    Red


SQL> create table reserves(sid int references sailors(sid),bid int references boats(bid),day date);

Table created.

SQL> desc reserves
 Name                                      Null?    Type
 ----------------------------------------- -------- ----------------------------
 SID                                                NUMBER(38)
 BID                                                NUMBER(38)
 DAY                                                DATE

SQL> insert into reserves values(22,101,'10/oct/98');

1 row created.

SQL> insert into reserves values(22,102,'10/oct/98');

1 row created.

SQL> insert into reserves values(22,103,'10/Aug/98');

1 row created.

SQL> insert into reserves values(22,104,'10/Jul/98');

1 row created.

SQL> insert into reserves values(31,102,'11/Oct/98');

1 row created.

SQL> insert into reserves values(31,103,'11/Jun/98');

1 row created.

SQL> insert into reserves values(31,104,'11/Dec/98');

1 row created.

SQL> insert into reserves values(64,101,'09/May/98');

1 row created.

SQL> insert into reserves values(64,102,'09/Aug/98');

1 row created.

SQL> insert into reserves values(74,103,'09/Aug/98');

1 row created.

SQL> select * from reserves;

       SID        BID DAY
---------- ---------- ---------
        22        101 10-OCT-98
        22        102 10-OCT-98
        22        103 10-AUG-98
        22        104 10-JUL-98
        31        102 11-OCT-98
        31        103 11-JUN-98
        31        104 11-DEC-98
        64        101 09-MAY-98
        64        102 09-AUG-98
        74        103 09-AUG-98

10 rows selected.

SQL> commit;

Commit complete.

SQL>